{
  "$schema": "https://json-schema.org/draft/2020-12/schema",
  "$id": "https://example.org/schemas/ai-instructions-update-receipt-v1.schema.json",
  "title": "AI Instructions update receipt v1",
  "type": "object",
  "additionalProperties": false,
  "required": [
    "schemaVersion",
    "checkedAtUtc",
    "mode",
    "channel",
    "ref",
    "currentCommit",
    "candidateCommit",
    "outcome",
    "archiveSha256",
    "message"
  ],
  "properties": {
    "schemaVersion": {
      "const": 1
    },
    "checkedAtUtc": {
      "type": "string",
      "format": "date-time"
    },
    "mode": {
      "enum": [
        "notify-only",
        "auto-install-approved"
      ]
    },
    "channel": {
      "enum": [
        "protected-branch",
        "github-release"
      ]
    },
    "ref": {
      "enum": [
        "main",
        "latest"
      ]
    },
    "currentCommit": {
      "$ref": "#/$defs/commit"
    },
    "candidateCommit": {
      "oneOf": [
        {
          "type": "null"
        },
        {
          "$ref": "#/$defs/commit"
        }
      ]
    },
    "outcome": {
      "description": "available is a notify-only result and never proves installation; installed is the only candidate-install success outcome.",
      "enum": [
        "current",
        "available",
        "installed",
        "offline",
        "stale",
        "drift",
        "failed"
      ]
    },
    "archiveSha256": {
      "oneOf": [
        {
          "type": "null"
        },
        {
          "$ref": "#/$defs/hash"
        }
      ]
    },
    "message": {
      "type": "string",
      "minLength": 1
    }
  },
  "allOf": [
    {
      "if": {
        "properties": {
          "channel": {
            "const": "protected-branch"
          }
        }
      },
      "then": {
        "properties": {
          "ref": {
            "const": "main"
          }
        }
      }
    },
    {
      "if": {
        "properties": {
          "channel": {
            "const": "github-release"
          }
        }
      },
      "then": {
        "properties": {
          "ref": {
            "const": "latest"
          }
        }
      }
    },
    {
      "if": {
        "properties": {
          "outcome": {
            "const": "current"
          }
        }
      },
      "then": {
        "properties": {
          "candidateCommit": {
            "type": "null"
          }
        }
      }
    },
    {
      "if": {
        "properties": {
          "outcome": {
            "enum": [
              "available",
              "installed",
              "stale",
              "drift"
            ]
          }
        }
      },
      "then": {
        "properties": {
          "candidateCommit": {
            "$ref": "#/$defs/commit"
          }
        }
      }
    },
    {
      "if": {
        "properties": {
          "outcome": {
            "enum": [
              "installed",
              "drift"
            ]
          }
        }
      },
      "then": {
        "properties": {
          "archiveSha256": {
            "$ref": "#/$defs/hash"
          }
        }
      }
    }
  ],
  "$defs": {
    "commit": {
      "type": "string",
      "pattern": "^[0-9a-f]{40}$"
    },
    "hash": {
      "type": "string",
      "pattern": "^[0-9a-f]{64}$"
    }
  }
}
